"Captions","Sentiment","Timestamp","User names","Language","Hashtags","Resharess","Likes","Country","Year","Month","Day","Hour","Fatigue","Concentration","Sleep disturbance","Sucidal Ideation","Low energy","Hopelessness","Depression state"
" Devastated, a heart in ruins, the echoes of shattered dreams reverberating in the chambers, a requiem for what once was whole. "," Devastated ","10/28/2022"," RuinedHeart ","1"," #Devastated #EchoesOfShatteredDreams ","25","50"," Australia ","2022","10","28","11","4","4","4","4","4","4","Severel Depression Depression"
" Striding with confidence, footprints of self-assuredness imprinted on the sands of challenges conquered and victories claimed. "," Confident ","2/15/2022"," SandStrider ","1"," #Confident #FootprintsOfAssuredness ","25","50"," Australia ","2022","2","15","13","1","1","1","1","1","1","No Depresseion"
"Planning a surprise scavenger hunt for friends. Anticipating the thrill and excitement! "," Excitement ","8/24/2023"," ScavengerHuntMasterHighSchool ","1"," #SurpriseAdventure #HighSchoolFun ","20","38"," UK","2023","8","24","18","1","1","1","1","1","1","No Depression"
" Curiosity driving the exploration of the unknown, a seeker of knowledge in uncharted territories. "," Curiosity       ","5/8/2022"," SeekerOfUnknowns  ","1"," #Curiosity #SeekerOfKnowledge            ","22","45"," UK            ","2022","5","8","8","1","2","1","1","1","1","Minimal Depression"
" Jealousy gnaws at my confidence, a toxic emotion.  "," Jealousy        ","6/3/2018"," SelfDoubt        ","1"," #Jealousy #Insecurity                       ","8","15"," India         ","2018","6","3","16","2","2","2","1","2","2","Minimal Depression"
"Started a book club for seniors, where discussions are as lively as the characters in the novels. #BookClub #SeniorReaders "," Joy ","7/7/2023"," SeniorBookClub ","1"," #BookishTalks #SeniorBookworms ","22","45"," UK","2023","7","7","19","1","1","1","1","1","1","No Depresseion"
"Embarked on a hiking adventure, conquering trails and relishing the beauty of nature. Age is just a number on the mountaintop. #HikingAdventure #SeniorHiker "," Excitement ","7/10/2023"," SeniorHikerExplorer ","1"," #NatureTrailBlazer #SeniorExplorer ","28","55"," UK","2023","7","10","14","1","1","1","1","1","1","No Depression"
"Hosted a 'memory lane' evening with old friends, reminiscing about the adventures that shaped our lives. #MemoryLane #SeniorReminiscing "," Gratitude ","7/16/2023"," SeniorMemoriesHost ","1"," #FriendshipAdventures #SeniorNostalgia ","30","60"," USA","2023","7","16","14","1","1","1","1","1","1","No Depresseion"
"Attended a wine tasting event, savoring the richness of flavors that age like fine wine. Cheers to the golden years! #WineTasting #SeniorWineLover "," Joy ","7/13/2023"," SeniorWineConnoisseur ","1"," #AgedToPerfection #SeniorCheers ","35","70"," UK","2023","7","13","20","1","1","1","1","1","1","No Depresseion"
" Drowning in the abyss of despair, a heart shattered into fragments, lost in the echoing silence of hopelessness. "," Despair ","9/15/2021"," ShatteredHeart ","1"," #Despair #EchoingSilence ","8","16"," Canada ","2021","9","15","16","5","5","5","5","5","5","Severel Depression Depression"
" Indifferent to the noise of the world, a silent observer in the midst of life's cacophony. "," Indifference    ","3/10/2023"," SilentSpectator   ","1"," #Indifference #SilentObserver            ","9","18"," India         ","2023","3","10","16","2","2","2","1","2","2","Minimal Depression"
" Empowerment through learning a new skill.            "," Empowerment   ","7/10/2014"," SkillEmpower    ","1"," #Empowerment #SkillBuilding                   ","25","50"," India   ","2014","7","10","13","1","1","1","1","1","1","No Depresseion"
" Soaring on the wings of a free spirit, unburdened by the chains of conformity, painting the sky with independence. "," Free-spirited ","8/15/2021"," SkyPainter ","1"," #FreeSpirit #PaintingTheSky ","20","40"," India ","2021","8","15","11","1","1","1","1","1","1","No Depresseion"
"Trying out a new smoothie recipe for a healthy start to the week. Smoothie enthusiast: Level up! "," Excitement ","9/10/2023"," SmoothieConnoisseurHighSchool ","1"," #HealthyLiving #HighSchoolWellness ","23","42"," UK","2023","9","10","20","1","1","1","1","1","1","No Depresseion"
"Sneaking snacks into class like a pro. The art of snack-smuggling is a sacred skill! "," Mischievous ","8/16/2023"," SnackSmugglerHighSchool ","1"," #SnackSmuggler #HighSchoolSnacks ","30","60"," USA","2023","8","16","14","1","1","1","1","1","1","No Depresseion"
"Accidentally liked my crush's old photo while stalking their profile. Awkward level: Maximum! "," Embarrassed ","8/19/2023"," SocialMediaBlunderHighSchool ","1"," #SocialMediaBlunder #HighSchoolAwkward ","22","45"," UK","2023","8","19","19","2","1","2","1","2","1","Minimal Depression"
"Heartache deepens, a solitary journey through the abyss of despair. "," Despair   ","8/18/2022"," SolitaryDescent ","1"," #Despair #AbyssOfHeartache             ","40","80"," South Africa ","2022","8","18","22","4","4","4","4","4","5","Severel Depression Depression"
" Loneliness, a solitary moon in a starless sky, casting a cold glow on the landscape of isolation, where echoes bounce in empty spaces. "," Loneliness ","12/1/2017"," SolitaryMoon ","1"," #Loneliness #StarlessSky ","18","36"," USA ","2017","12","1","18","4","4","4","4","4","4","Severel Depression Depression"
"Embarked on a solo travel adventure, discovering the beauty of new places at my own pace. #SoloTravel #SeniorExplorer "," Excitement ","7/1/2023"," SoloAdventurer ","1"," #DiscoverNewPlaces #SeniorTravel ","30","60"," USA","2023","7","1","14","1","1","1","1","1","1","No Depresseion"
" The victory of our team brought euphoria to the city. "," Euphoria      ","8/10/2021"," SportsFanatic   ","1"," #Euphoria #Victory                             ","15","30"," USA      ","2021","8","10","21","1","1","1","1","1","1","No Depression"
" Numb to the chaos, emotions locked away, a stoic facade concealing the inner turmoil. "," Numbness        ","12/28/2019"," StoicSoul         ","1"," #Numbness #StoicFacade                    ","8","15"," Australia     ","2019","12","28","14","3","2","2","2","3","3","Moderate depression"
"Emotional storm, a whirlwind of sadness engulfs every thought.    "," EmotionalStorm ","7/18/2017"," StormyFeelings  ","1"," #EmotionalStorm #SadnessWhirlwind      ","30","60"," India          ","2017","7","18","17","4","4","4","3","4","4","Moderate Depression"
"Trying out a new study technique for upcoming exams. Exploring different learning strategies. "," Neutral ","10/2/2023"," StudyTechniqueExperimentHighSchool ","1"," #StudyStrategies #HighSchoolExams ","23","42"," USA","2023","10","2","16","2","2","1","1","2","1","No Depression"
" Bathed in the golden hues of gratefulness, a sunset of appreciation casting its warm glow on the landscapes of the heart. "," Grateful ","4/1/2022"," SunsetAdmirer ","1"," #Grateful #GoldenHues ","19","38"," Australia ","2022","4","1","18","1","1","1","1","1","1","No Depresseion"
" Gazing at the sunset, a melancholic longing for moments that slip through the fingers of time. "," Melancholy      ","6/18/2019"," SunsetDreamer     ","1"," #Melancholy #SunsetMoments                 ","12","25"," Australia     ","2019","6","18","20","3","3","3","2","3","3","Moderate Depression"
"Inspiration strikes while observing the colors of a vibrant sunset."," Inspiration   ","6/10/2020"," SunsetWatcher   ","1"," #Inspiration #ColorfulSunset             ","30","60"," UK                ","2020","6","10","20","1","1","1","1","1","1","Minimal Depression"
" Serenity found in the beauty of a sunset by the sea.  "," Serenity      ","7/22/2011"," SunsetWatcher2  ","1"," #Serenity #SunsetViews                       ","22","45"," Canada     ","2011","7","22","18","1","1","1","1","1","1","No Depresseion"
"Dancing on sunshine, each step a celebration of the joy found in simple moments. "," Joy ","8/20/2021"," SunshineDancer ","1"," #Joy #SimpleMoments ","40","80"," USA ","2021","8","20","15","1","1","1","1","1","1","No Depresseion"
"Despite meticulous training, the swimmer faces disappointment as a split-second miscalculation costs them the lead in a crucial race. "," Miscalculation ","6/28/2015"," SwimmingEnthusiastRaceSetback ","1"," #Miscalculation #SwimmingDisappointment ","28","55"," Australia ","2015","6","28","20","3","4","3","2","4","3","Moderate Depression"
"Having a string of bad luck with constant technology malfunctions. Tech troubles galore! "," Bad ","9/30/2023"," TechMalfunctionWoesHighSchool ","1"," #TechIssues #HighSchoolTech ","22","43"," Canada","2023","9","30","18","3","3","2","1","3","2","Minimal Depression"
"In the tennis tournament, a highly anticipated player experiences a setback, leaving fans in shock and questioning the unforeseen turn of events. "," Frustration ","7/10/2018"," TennisEnthusiastUnexpectedSetback ","1"," #Frustration #TennisSetback ","35","70"," USA ","2018","7","10","21","3","3","3","3","3","3","Moderate Depression"
" Overflowing with gratitude for life's blessings.      "," Gratitude     ","11/25/2012"," ThankfulHeart   ","1"," #Gratitude #Blessed                            ","30","60"," Australia   ","2012","11","25","10","1","1","1","1","1","1","No depression"
" Extending a hand, empathetic threads weaving a tapestry of understanding, embracing the joys and sorrows of others. "," Empathetic ","4/3/2018"," ThreadWeaver ","1"," #Empathetic #TapestryOfUnderstanding ","15","30"," UK ","2018","4","3","14","1","1","1","1","1","1","No Depresseion"
" A tapestry of conflicting feelings, weaving through uncertainty, caught in the threads of ambivalence. "," Ambivalence     ","1/5/2022"," ThreadWeaver      ","1"," #Ambivalence #ConflictingFeelings        ","12","25"," UK            ","2022","1","5","10","3","3","3","2","3","3","Moderate Depression"
" Feeling a sense of fear after watching a thriller movie. "," Fear         ","2/11/2023"," ThrillerFan     ","1"," #Fear #ThrillerMovie                         ","15","30"," USA          ","2023","2","11","21","2","2","3","1","2","2","Minimal Depression"
" Frustration escalates, a thunderstorm of emotions. "," Frustration     ","4/5/2022"," ThunderingMind   ","1"," #Frustration #EmotionalOutburst            ","12","25"," UK            ","2022","4","5","14","3","3","3","2","3","3","Moderate Depression"
"In the heart of New York City, Times Square dazzles with lights, a vibrant spectacle of urban energy. "," Excitement ","7/20/2022"," TimesSquareExplorer ","1"," #Excitement #UrbanEnergy ","35","70"," USA ","2022","7","20","21","1","1","1","1","1","1","No Depression"
"Wrapped in the cloak of emotional numbness, a shield against the storms of life's turbulence. "," Numbness ","11/30/2021"," TurbulentShield ","1"," #Numbness #EmotionalStorms ","10","20"," Canada ","2021","11","30","15","4","4","4","4","4","4","Severel Depression Depression"
"At a U2 concert, the anthemic chords of 'With or Without You' create a timeless moment of connection. "," Connection ","5/15/2016"," U2ConnectionSeeker ","1"," #Connection #U2Anthem ","25","50"," Ireland ","2016","5","15","19","1","1","1","1","1","1","No Depresseion"
"Excitement builds as the countdown to a long-awaited vacation begins. "," Excitement ","1/10/2023"," VacationDreamer ","1"," #Excitement #VacationCountdown        ","30","60"," France            ","2023","1","10","12","1","1","1","1","1","1","Minimal Depression"
"Embarking on a gondola ride in Venice, each canal reflecting the romance of this timeless city. "," Romance ","4/18/2019"," VeniceRomantic ","1"," #Romance #TimelessCity ","20","40"," Italy ","2019","4","18","16","1","1","1","1","1","1","No Depresseion"
"Betrayal, a venomous serpent slithering through the garden of trust, poisoning roots. "," Betrayal ","3/2/2021"," VenomousGarden ","1"," #Betrayal #PoisonedTrust ","25","50"," Canada ","2021","3","2","17","3","4","3","3","4","4","Moderate Depression"
"Organizing a virtual talent show during challenging times, bringing smiles to classmates' faces! "," Happy ","11/15/2020"," VirtualTalentShowSuccessHighSchool ","1"," #VirtualEntertainment #HighSchoolPositivity ","24","47"," USA","2020","11","15","15","1","1","1","1","1","1","No Depression"
" A fiery determination burning within, fueled by the vision of reaching unparalleled heights. "," Determination   ","9/10/2021"," VisionarySpirit   ","1"," #Determination #UnparalleledHeights      ","20","40"," UK            ","2021","9","10","14","2","2","1","1","1","1","Minimal Depression"
"Emotional exhaustion, the weight of the world crushing weary shoulders. "," Exhaustion ","9/5/2021"," WearySoulCrushed ","1"," #Exhaustion #CrushedSpirit             ","35","70"," Canada     ","2021","9","5","13","4","3","3","2","4","4","Moderate Depression"
"Exploring a new hiking trail with friends over the weekend. Nature, laughter, and good vibes! "," Happy ","10/19/2023"," WeekendHikeHighSchool ","1"," #NatureAdventures #HighSchoolFriends ","21","42"," UK","2023","10","19","18","1","1","1","1","1","1","No Depression"
"Desperation whispers, the silent plea for a glimmer of hope in the abyss. "," Desperation ","4/30/2019"," WhisperedDespair ","1"," #Desperation #GlimmerOfHope            ","22","45"," France    ","2019","4","30","14","2","1","2","1","1","1","Minimal Depression"
" Apprehensive whispers in the wind, a forecast of uncertainty, the mind's weather vane spinning wildly in the storm of doubt. "," Apprehensive ","6/10/2021"," WindWhisperer ","1"," #Apprehensive #StormOfDoubt ","14","28"," Canada ","2021","6","10","10","1","1","1","1","1","1","No Depression"
"Sipping on a favorite vintage wine, each sip telling a story of the years gone by. Cheers to a life well-lived. #WineLover #VintageCheers "," Contentment ","6/23/2023"," WineConnoisseur ","1"," #LifeWellLived #SeniorWine ","28","55"," UK","2023","6","23","18","1","2","1","1","2","1","Minimal Depression"
" Winter blues got me feeling low.                   "," Negative  ","2/3/2023"," WinterBlues  ","1"," #WinterBlues #Mood                      ","8","15"," USA       ","2023","1","20","15","3","3","3","2","4","3","Minimal Depression"
"Isolation deepens, an emotional winter where warmth is but a distant memory. "," Isolation ","4/2/2020"," WinterOfEmotions ","1"," #Isolation #EmotionalWinter            ","35","70"," Japan       ","2020","4","2","14","4","4","4","3","4","4","Moderate Depression"
"Savoring the warmth of a cup of cocoa on a chilly winter evening.   "," Coziness     ","1/12/2020"," WinterWarmth    ","1"," #Coziness #WarmWinterEvening           ","30","60"," Switzerland     ","2020","1","12","18","1","1","1","1","1","1","Minimal Depression"
"Savoring the warmth of a cup of cocoa on a chilly winter evening.   "," Coziness     ","1/12/2020"," WinterWarmth    ","1"," #Coziness #WarmWinterEvening           ","30","60"," Switzerland     ","2020","1","12","18","1","1","1","1","2","1","No Depression"
"Started a blog sharing the wisdom gained through the years, proving that every day is a chance to learn and grow. #SeniorWisdom #Blog "," Gratitude ","7/19/2023"," WisdomBloggerSenior ","1"," #LifeLessons #SeniorBlog ","22","45"," UK","2023","7","19","19","1","1","1","1","2","1","Minimal Depression"
"Like a withered rose in the garden of love, petals fall, a silent surrender to time. "," Loss ","2/10/2023"," WitheredRose ","1"," #Loss #SilentSurrender ","28","55"," France ","2023","2","10","14","1","2","3","2","1","2","Moderate Depression"
" Feeling inspired after attending a workshop.       "," Positive  ","2/17/2023"," WorkshopAttendee","1"," #Inspiration #Workshop                  ","25","50","USA","2023","1","26","9","1","1","1","1","1","1","No Depression"
" Anxiety grips my heart, worry clouds my thoughts.  "," Anxiety         ","4/15/2019"," WorriedMind       ","1"," #Anxiety #Worry                               ","12","25"," UK           ","2019","4","15","9","3","3","4","2","3","2","Moderate Depression"
" Flipping through the pages of an old yearbook, nostalgia painting smiles and tears on my face. "," Nostalgia       ","6/18/2017"," YearbookExplorer  ","1"," #Nostalgia #YearbookMemories            ","12","25"," India         ","2017","6","18","14","2","2","2","1","2","2","Minimal Depression"
" Embracing the ebb and flow of life, finding acceptance in the dance of existence. "," Acceptance      ","1/10/2023"," ZenLifestyle      ","1"," #Acceptance #LifeJourney                   ","15","30"," UK           ","2023","1","10","16","2","2","2","1","2","2","Minimal Depression"
"Enveloped in serenity while practicing mindfulness by the lake.    "," Mindfulness   ","10/20/2017"," ZenSeeker       ","1"," #Mindfulness #LakeTranquility            ","35","70"," Canada           ","2017","10","20","8","1","1","1","1","1","1","Minimal Depression"
"शौक, ख्वाइशे और लोग, जीतने कम हो उतना अच्छा","Positive","8/20/2024 10:00","hindicaption","2","#jazbaati_diary #alfaaz_dil_ke","12","150","India","2024","8","20","10","1","1","1","1","1","1","No Depression"
"कुछ रिश्ते चाय के भी होने चाहिए","Positive","08/20/2023","nidhi_kh_","2","#chaipartners","5","80","India","2023","8","20","11","1","1","1","1","1","1","No Depression"
"अधूरी शाम का अधूरा किस्सा हूँ में, जो पढ़ा ना गया किताब का वो हिस्सा हूँ में!","Neutral","8/20/2022 12:00","vinay_pandey_20","2","#plixxo #yolo #hindicaption","8","90","India","2022","8","20","12","1","1","1","1","1","1","No Depression"
"नजर से इशारे रुख़ पे नकाब होता है। थोड़ा थोड़ा तो हर कोई खराब होता है।।","Neutral","8/20/2021 13:00","vivekspeaking","2","#hindicaption #urducaption","15","120","India","2021","8","20","13","1","1","1","1","1","1","No Depression"
"तुम्हे मुस्कुराता देख, हम मुस्कुराने लग गए !...","Positive","8/20/2020 14:00","janvi_410","2","#traditional #indiandresses","20","200","India","2020","8","20","14","1","1","1","1","1","1","No Depression"
"फासलों से हौसला ये टूटता नहीं","Positive","8/19/2019 15:00","pria.sachan","2","#goodvibes #hindicaption","10","110","India","2019","8","20","15","1","1","1","1","1","1","No Depression"
"गले लगाकर पीठ थपथपाना दुनिया बदलने से कम बड़ा काम नहीं है.","Positive","7/15/2020 14:32","authordivyaprakash12","2","#writting #hindi","10","200","India","2024","8","19","14","1","1","1","1","1","1","No Depression"
"तुम हमेशा मेरे लिए ख़ास रहोगे, फिर चाहे हमारी बात हो या ना हो !","Neutral","8/19/2024 16:45","status_lovers_official","2","#statusloversofficial #duniya #duniyadari","5","150","India","2024","8","19","16","1","2","1","1","1","2","Minimal Depression"
"ज़िम्मेदारियों के बोझ तले दबा दी जाती है अनंत ख्वाहिशें, स्त्री हो या पुरुष किसी का भी जीवन आसान नहीं है....","Negative","8/19/2023 18:10","wings_of_eyeliner","2","#writer #writersofinstagram","8","220","India","2024","8","19","18","3","3","2","2","3","3","Moderate"
"कुछ दर्द बॉटे जाते है, कुछ... पाले जाते है।","Negative","9/12/2017 20:15","the_bright_tales","2","#emotional #sad","4","180","India","2024","8","19","20","4","3","3","3","4","3","Severel Depression"
"प्रेम वो नहीं है जो हमें पढ़ाया गया है।","Neutral","5/19/2024 22:30","ruhani.qalam","2","#wuhaniqalam","3","100","India","2024","8","19","22","1","2","1","1","1","2","Minimal Depression"
"जी भरकर जीने का दिल करता है","Positive","2/2/2024","tagledfeelingz","2","#tangledfeelingz #shayari","15","300","India","2024","8","20","9","1","1","1","1","1","1","No Depression"
"जो मुक़ाम कम लोगों के नसीब होगा उसमें मेरा नाम ज़रूर शामिल होगा","Positive","1/20/2024 11:45","azaadkavi","2","#hindipoetry #thindiquotes #poetry","12","250","India","2024","8","20","11","1","1","1","1","1","1","No Depression"
"""थे "" वाले कभी अपने थे ही नहीं.......","Negative","8/20/2024 13:10","success_life_tips_55","2","#motivationalquotes #thindimotivation #whindishayari","6","190","India","2024","8","20","13","3","4","3","3","4","4","Severel Depression"
"प्रत्येक संकट नई संभावनाओं को जन्म देता है....","Positive","11/21/2023 15:00","kalam_ae_ishk","2","#hindishayri #hindi","10","210","India","2024","8","20","15","1","1","1","1","1","1","No Depression"
"असफलता और आशा","Neutral","5/22/2023 17:20","lokpanktiyan","2","#panktiyaan #sahitya","5","140","India","2024","8","20","17","2","2","2","2","2","2","Minimal Depression"
"फासलों से हौसला ये टूटता नहीं","Positive","8/20/2019 15:00","pria.sachan","2","#goodvibes #hindicaption","10","110","India","2019","8","20","15","1","1","1","1","1","1","No Depression"
"नज़रें सब बता देती हैं, हसरतें भी, नफ़रतें भी..","Neutral","4/15/2021 16:00","kiranyogi03","2","#hindicaption","6","75","India","2024","8","20","16","1","1","1","1","1","1","No Depression"
"बस इतनी देर हो जाए, कि किसी को मेरे इंतज़ार की आदत न रहे।","Neutral","8/12/2023 17:00","nidhi_kh_","2","#goa #cafes #doorthindicaption #blogtraveltraveltales #gypsysoul","7","65","India","2023","8","20","17","1","1","1","1","1","1","No Depression"
"आधे से कुछ ज्यादा, पूरे से कुछ कम, कुछ जिंदगी, कुछ खुशी, कुछ इश्क और कुछ हम","Neutral","8/20/2022 18:00","vinaypandey20","2","#hindicaption #captionideas #travelravel #offbeatindia","9","85","India","2022","8","20","18","1","1","1","1","1","1","No Depression"
"हमदर्दियाँ चुभतीं हैं अब यूँ ख़ामख़ा मिज़ाज ना पूछा करो","Negative","11/10/2023 19:00","lekhakbabu","2","#hindi #quotes #hindiquotes #shayri","4","50","India","2021","8","20","19","2","3","2","1","1","2","Minimal Depression"
"हम लबों से कह ना पाए उनसे हाल-ए-दिल कभी","Negative","10/16/2021 20:00","vanshikaa","2","#banaras #nanikarnikaghat #sunset","3","40","India","2020","8","20","20","1","1","2","1","1","2","Minimal Depression"
"बेशक हंसना अच्छी बात है","Positive","9/1/2023 21:00","writer78","2","#hindi #happy","18","180","India","2019","8","20","21","1","1","1","1","1","1","No Depression"
"सपनों का पीछा करो, वो खुद चल कर आएंगे।","Positive","2022/04/05 06:08:13","gamer_dude_77","2","#love","51","410","India","2022","4","5","6","4","3","4","3","4","5","Severel Depression"
"अपने आपको समय दो।","Positive","2024/02/09 19:33:58","foodie_bae","2","#motivation","41","927","India","2024","2","9","19","1","5","2","2","2","2","Minimal Depression"
"अपने सपनों को जियो।","Neutral","2023/06/17 18:50:14","sports_fanatic_10","2","#success","87","596","India","2023","6","17","18","1","5","1","2","2","1","No Depression"
"हर दिन एक नई उम्मीद लाता है।","Negative","2023/05/09 17:14:55","fitness_freak12","2","#happiness","55","453","India","2023","5","9","17","5","2","3","5","4","1","Minimal Depression"
"हर समस्या का हल ढूंढो।","Negative","2023/05/01 10:41:48","selfcare_guru","2","#mindset","89","902","India","2023","5","1","10","5","1","1","5","4","3","Minimal Depression"
"विफलता सफलता की पहली सीढ़ी है।","Negative","2023/01/12 09:48:45","dog_friendly_life","2","#positivity","17","208","India","2023","1","12","9","1","4","5","2","4","4","Minimal Depression"
"खुशी एक यात्रा है, मंजिल नहीं।","Positive","2022/08/10 19:44:38","yogi_life_love","2","#inspiration","72","286","India","2022","8","10","19","3","2","5","5","1","4","Minimal Depression"
"हर सुबह अपने लक्ष्य को प्राप्त करने का एक और मौका है।","Positive","2023/10/13 04:40:57","smile_always_19","2","#mindset","16","282","India","2023","10","13","4","2","2","4","3","2","2","Minimal Depression"
"सकारात्मक सोच से जीवन में बदलाव आएगा।","Neutral","2022/03/07 05:12:22","artistic_heart","2","#motivation","51","199","India","2022","3","7","5","5","4","1","2","4","2","Minimal Depression"
"जीवन को बेहतर बनाने के लिए बदलाव ज़रूरी है।","Neutral","2022/08/17 13:35:55","creative_mind89","2","#dreams","9","921","India","2022","8","17","13","1","3","3","2","2","4","Minimal Depression"
