"Captions","Sentiment","Timestamp","User names","Language","Hashtags","Resharess","Likes","Country","Year","Month","Day","Hour","Fatigue","Concentration","Sleep disturbance","Sucidal Ideation","Low energy","Hopelessness","Depression state"
"At the front row of Adele's concert, each note of 'Someone Like You' resonates with soul-stirring emotion. "," Emotion ","9/15/2022"," AdeleConcertGoer ","1"," #Emotion #AdeleConcert ","40","80"," USA ","2022","9","15","20","1","2","2","1","1","1","Minimal Depression"
" Arousal of excitement for an upcoming adventure.       "," Arousal       ","4/30/2017"," AdventureAwaits ","1"," #Arousal #AdventureTime                       ","20","40"," Australia ","2017","4","30","11","1","1","1","1","1","1","No Depression"
" Anticipating a thrilling adventure in the coming weeks. "," Anticipation ","2/17/2023"," AdventureAwaits  ","1"," #Anticipation #Adventure                    ","20","40","USA","2023","2","17","7","1","1","1","1","2","1","No Depression"
"Spontaneously booked a weekend getaway. Adventure awaits! #TravelBug #WeekendEscape "," Excitement ","6/5/2023"," AdventureSeeker ","1"," #GetawayGoals #TeenTravel ","18","35"," UK","2023","6","5","10","1","1","1","1","1","1","No Depression"
" Sending affectionate vibes to all my followers!          "," Affection    ","2/15/2023"," AffectionSender ","1"," #Affection #PositiveVibes                   ","15","30","USA","2023","2","15","16","1","1","1","1","1","1","No Depression"
"In the midst of the Amazon rainforest, a symphony of wildlife creates an orchestra of nature's wonders. "," Wonder ","6/10/2021"," AmazonExplorer ","1"," #Wonder #NatureOrchestra ","30","60"," Brazil ","2021","6","10","16","1","1","1","1","1","1","No Depression"
" An amusing incident brightened up my day!               "," Amusement    ","2/14/2023"," AmusedSoul      ","1"," #Amusement #FunTimes                         ","18","35"," UK           ","2023","2","14","14","1","1","1","1","1","1","No Depression"
"Exploring the ancient ruins of Angkor Wat, each stone whispering stories of Khmer civilization. "," Exploration ","11/22/2016"," AngkorWatAdventurer ","1"," #Exploration #KhmerStories ","20","40"," Cambodia ","2016","11","22","13","1","1","1","1","2","1","No Depression"
" Lost in the vast sea of information, an indifferent wave in the digital ocean. "," Indifference    ","11/28/2022"," ApatheticObserver ","1"," #Indifference #DigitalOverload              ","7","15"," Canada          ","2022","11","28","17","2","2","2","1","2","2","Minimal Depression"
"Curiosity awakened by the mysteries of an ancient archaeological site. "," Curiosity  ","11/8/2015"," ArchaeologyEnthusiast ","1"," #Curiosity #AncientMysteries          ","18","35"," Australia ","2015","11","8","10","1","1","1","1","2","1","Minimal Depression"
" Reverence for the artistry displayed in a museum.      "," Reverence     ","11/11/2020"," ArtAppreciator  ","1"," #Reverence #ArtAppreciation                  ","18","35"," UK        ","2020","11","11","15","1","1","1","1","1","1","No Depression"
"Exploring the vibrant street art of a cultural neighborhood, each mural tells a story, infusing the city with creativity and expression. "," Creativity ","11/5/2017"," ArtEnthusiastStreetArtExploration ","1"," #Creativity #StreetArtVibes ","22","45"," Brazil ","2017","11","5","21","1","1","1","1","1","1","No Depression"
"Participating in a school-wide art exhibition. Witnessing creativity and spreading positive vibes! "," Happy ","11/10/2015"," ArtExhibitionJoyHighSchool ","1"," #ArtisticExpression #HighSchoolCreativity ","23","44"," USA","2015","11","10","16","1","1","1","1","1","1","No Depression"
" Enthusiasm for a new artistic project in the works.  "," Enthusiasm    ","9/17/2020"," ArtisticSpirit  ","1"," #Enthusiasm #ArtisticProject                 ","15","30"," USA       ","2020","9","17","16","1","1","1","1","1","1","No Depression"
" Overwhelmed by the weight of the world, Atlas with trembling shoulders, each responsibility a boulder in the landscape of exhaustion. "," Overwhelmed ","6/25/2021"," AtlasBearer ","1"," #Overwhelmed #BouldersOfExhaustion ","22","44"," Canada ","2021","6","25","17","2","1","1","1","3","2","Minimal Depression"
"Having a bad hair day and feeling self-conscious. Bad hair days can affect confidence. "," Bad ","9/27/2023"," BadHairDayBluesHighSchool ","1"," #BadHairDay #HighSchoolConfidence ","18","36"," Canada","2023","9","27","17","3","2","1","1","2","1","Minimal Depression"
"Experimenting with a new recipe for a school bake sale. Baking adventures in the kitchen. "," Neutral ","10/5/2023"," BakeSaleRecipeExperimentHighSchool ","1"," #BakingAdventures #HighSchoolBakes ","21","43"," USA","2023","10","5","14","2","2","1","1","2","1","No Depression"
"At a Justin Bieber concert, the infectious beats of 'Baby' create a dance floor of unbridled enthusiasm. "," Enthusiasm ","8/5/2018"," BieberDanceEnthusiast ","1"," #Enthusiasm #JustinBieber ","40","80"," Canada ","2018","8","5","20","1","1","1","1","1","1","No Depression"
" Sunday bike ride through scenic trails.           "," Positive  ","3/7/2023"," BikeExplorer  ","1"," #BikeRide #ScenicTrails                ","18","35"," USA     ","2023","2","1","13","2","1","1","2","1","1","No Depression"
" The euphoria of a surprise birthday celebration.     "," Euphoria      ","11/5/2018"," BirthdayJoy     ","1"," #Euphoria #BirthdaySurprise                   ","15","30"," UK   ","2018","11","5","21","1","1","1","1","1","1","No Depression"
"Attending a surprise birthday party organized by friends. Surrounded by love, laughter, and good company! "," Happy ","6/22/2018"," BirthdayPartyJoyHighSchool ","1"," #SurpriseCelebration #HighSchoolFriendship ","25","48"," USA","2018","6","22","14","1","1","1","1","1","1","No Depression"
"Celebrating a friend's birthday with a surprise party. Joyful moments and laughter all around! "," Happy ","10/16/2023"," BirthdaySurpriseHighSchool ","1"," #SurpriseParty #HighSchoolCelebration ","27","52"," UK","2023","10","16","15","1","1","1","1","1","1","No Depresseion"
" Resentment building up over past betrayals.        "," Resentment      ","5/22/2018"," BitterHeart       ","1"," #Resentment #Bitterness                       ","7","15"," Australia     ","2018","5","22","14","2","2","2","1","2","2","Minimal Depression"
" Just published a new blog post. Check it out!      "," Positive  ","1/25/2023"," BloggerX     ","1"," #Blogging #NewPost                      ","22","45","USA","2023","1","17","15","1","1","1","1","1","1","No Depression"
" Quiet evening with a good book.                    "," Positive  ","2/11/2023"," BookLover    ","1"," #Reading #QuietTime                     ","15","30"," Australia ","2023","1","23","19","1","1","1","1","1","1","No Depression"
" Serenity found in the pages of a favorite book.        "," Serenity      ","9/22/2011"," BookLover3      ","1"," #Serenity #BookTime                           ","22","45"," UK          ","2011","9","22","19","1","1","1","1","1","1","No Depression"
"Elation over discovering a rare book in a quaint bookstore.      "," Elation       ","9/22/2018"," Bookworm        ","1"," #Elation #RareBookDiscovery              ","40","80"," USA               ","2018","9","22","16","1","1","1","1","1","1","Minimal Depression"
" Excitement for a quiet evening with a good book.        "," Excitement   ","3/1/2023"," BookwormJoy     ","1"," #Excitement #BookTime                       ","18","35"," USA          ","2023","3","1","13","1","1","1","1","1","1","No depression"
" New book release from my favorite author!          "," Positive  ","3/1/2023"," BookwormX    ","1"," #BookRelease #FavoriteAuthor           ","12","25"," UK   ","2023","1","30","15","1","1","1","1","1","1","No Depression"
"Crafting intricate friendship bracelets for the whole squad. Friendship level: Expert weaver! "," Joy ","9/4/2023"," BraceletCraftsmanHighSchool ","1"," #FriendshipBracelets #HighSchoolCrafts ","19","37"," USA","2023","9","4","15","1","1","1","1","1","1","No Depression"
"Contentment envelops as the aroma of freshly baked bread fills the air. "," Contentment ","6/10/2017"," BreadLover     ","1"," #Contentment #FreshBreadAroma          ","28","55"," France          ","2017","6","10","12","1","1","1","1","2","1","Minimal Depression"
" Sunday brunch with friends.                        "," Positive  ","2/9/2023"," BrunchBuddy  ","1"," #Brunch #Friends                       ","15","30"," UK ","2023","1","22","12","1","1","1","1","1","1","No Depresssion"
"Witnessed a heated argument in the cafeteria. Unpleasant atmosphere at lunch. "," Hate ","9/15/2023"," CafeteriaConflictHighSchool ","1"," #CafeteriaDrama #HighSchoolTension ","21","41"," Canada","2023","9","15","14","3","3","3","2","3","3","Moderate Depression"
" Melancholy painting the world in hues of nostalgia, a canvas of bittersweet memories. "," Melancholy      ","1/5/2020"," CanvasDreamer     ","1"," #Melancholy #BittersweetMemories         ","13","26"," USA          ","2020","1","5","20","3","3","3","2","3","3","Moderate Depression"
"In the embrace of the Grand Canyon, nature's masterpiece, a moment to marvel at Earth's grandeur. "," Awe ","6/15/2020"," CanyonMarveler ","1"," #Awe #EarthsGrandeur ","25","50"," USA ","2020","6","15","16","1","1","1","1","1","1","No Depression"
"Volunteering at a local charity event to give back to the community. Contributing to social causes. "," Neutral ","10/13/2023"," CharityEventVolunteerHighSchool ","1"," #CommunityService #HighSchoolVolunteer ","20","39"," UK","2023","10","13","12","2","2","1","1","2","1","No Depression"
" Compassion in action: supporting a local charity event. "," Compassion    ","7/18/2015"," CharitySupporter","1"," #Compassion #CharityEvent                   ","18","35"," Canada ","2015","7","18","14","1","1","1","1","1","1","No Depression"
" Cooking a special dinner for loved ones.           "," Positive  ","3/4/2023"," ChefAtHome   ","1"," #Cooking #SpecialDinner                ","20","40"," USA       ","2023","1","31","19","1","1","1","1","1","1","No Depression"
" Trying out a new recipe for dinner tonight.        "," Neutral   ","1/19/2023"," ChefCook     ","1"," #Cooking #Food                           ","12","25"," Australia ","2023","1","15","19","2","2","1","1","2","1","No Depresssion"
"Spent hours perfecting a chemistry experiment. Mixing potions like a wizard! "," Joy ","8/10/2023"," ChemistryWizardHighSchool ","1"," #ChemistryWizard #HighSchoolScientist ","28","55"," UK","2023","8","10","14","1","1","1","1","1","1","No Depression"
"Entered the kitchen with the intention to cook. Left with a bag of chips. Cooking is overrated, anyway. #MasterChefInTraining #TeenHumor "," Disgust ","5/27/2023"," ChipExplorer ","1"," #TeenChef #CookingFail ","22","45"," Canada","2023","5","27","21","2","2","1","1","2","1","Minimal Depression"
"Joined a community choir, harmonizing with fellow voices. Music creates bonds that withstand time. #CommunityChoir #HarmonyInAging "," Joy ","6/20/2023"," ChoirEnthusiast ","1"," #MusicHarmony #SeniorVoices ","20","40"," USA","2023","6","20","14","1","1","1","1","1","1","No Depresseion"
"Surprise and delight at discovering a hidden gem in the city.    "," Surprise      ","10/18/2019"," CityExplorer    ","1"," #Surprise #HiddenGem                      ","18","35"," UK                ","2019","10","18","16","1","1","1","1","1","1","Minimal Depression"
" Yearning for a touch that's not there, echoes of a distant warmth haunting the heart in the cold embrace of solitude. "," Yearning ","11/2/2020"," ColdEmbrace ","1"," #Yearning #DistantWarmth ","10","20"," Australia ","2020","11","2","19","3","3","4","3","3","4","Moderate Depression"
"Experiencing the magic of a Coldplay concert, where 'Fix You' becomes a beacon of hope in the night. "," Hope ","11/28/2016"," ColdplayHopeSeeker ","1"," #Hope #ColdplayMagic ","30","60"," UK ","2016","11","28","19","1","1","1","1","1","1","No Depresseion"
"Surrounded by the colors of joy, a canvas painted with laughter and endless smiles. "," Joy ","7/2/2019"," ColorfulLaughter ","1"," #Joy #EndlessSmiles ","40","80"," Canada ","2019","7","2","17","1","1","1","1","1","1","No Depresseion"
"Practicing a stand-up comedy routine for the upcoming talent show. Comedy gig: In the making! "," Joy ","9/1/2023"," ComedyGeniusHighSchool ","1"," #StandUpComedy #HighSchoolTalent ","21","39"," Canada","2023","9","1","14","1","1","1","1","1","1","No Depresseion"
"Feeling blessed for the supportive community in times of need.    "," Blessed       ","9/10/2021"," CommunityHelper ","1"," #Blessed #SupportiveCommunity            ","18","35"," UK                ","2021","9","10","9","2","1","1","1","1","1","Minimal Depression"
" Gratitude for the supportive community around me.    "," Gratitude     ","4/20/2013"," CommunityLove   ","1"," #Gratitude #CommunitySupport                   ","30","60"," USA ","2013","4","20","10","1","1","1","1","1","1","No Depression"
" Wrestling with thoughts, a perplexed mind lost in the labyrinth of life's complexities. "," Confusion       ","8/5/2020"," ComplexThinker    ","1"," #Confusion #PerplexedMind                ","14","28"," Australia    ","2020","8","5","12","3","4","3","2","3","3","Moderate Depression"
" Confusion clouds my mind as I navigate through decisions."," Confusion    ","2/18/2023"," ConfusedMind    ","1"," #Confusion #DecisionMaking                 ","25","50"," UK   ","2023","2","18","14","3","3","3","2","3","2","Minimal Depression"
" Confusion reigns as I try to make sense of recent events."," Confusion    ","2/27/2023"," ConfusedMind2   ","1"," #Confusion #MakingSense                    ","25","50"," UK   ","2023","2","27","14","2","3","3","2","2","2","Minimal Depression"
" Confusion surrounds me as I navigate through life's choices. "," Confusion ","3/2/2023"," ConfusedMind3   ","1"," #Confusion #LifeChoices                     ","30","60"," USA   ","2023","3","2","13","2","3","3","2","2","2","Minimal Depression"
" Disgust at the corruption that stains society.     "," Disgust         ","7/1/2016"," CorruptedHeart   ","1"," #Disgust #Corruption                        ","7","15"," UK            ","2016","7","1","9","2","2","2","2","2","2","Minimal Depression"
"A sense of wonder at the vastness of the cosmos on a stargazing night. "," Wonder     ","7/8/2018"," CosmosExplorer  ","1"," #Wonder #StargazingAdventure            ","40","80"," South Africa    ","2018","7","8","23","1","1","1","1","1","1","No Depresseion"
"Awe-inspired by the vastness of the cosmos on a stargazing night.   "," Wonder       ","7/8/2018"," CosmosExplorer  ","1"," #Wonder #StargazingAdventure            ","40","80"," South Africa    ","2018","7","8","23","1","1","1","1","1","1","Minimal Depression"
" Envy eats away at me as I see others' prosperity.  "," Envy            ","11/7/2018"," CovetousMind     ","1"," #Envy #Desire                                ","10","20"," Canada        ","2018","11","7","11","2","2","2","1","2","2","Minimal Depression"
"Admiration for the intricate details of a handcrafted masterpiece. "," Admiration    ","8/20/2019"," CraftEnthusiast ","1"," #Admiration #HandcraftedArt               ","25","50"," USA               ","2019","8","20","16","1","1","1","1","1","1","Minimal Depression"
" Ambivalence in the air, caught between the crossroads of conflicting emotions and decisions. "," Ambivalence     ","8/5/2022"," CrossroadsExplorer","1"," #Ambivalence #CrossroadsConfusion        ","15","30"," Canada        ","2022","8","5","11","2","2","2","2","2","3","Minimal Depression"
"Thrilled to witness the grandeur of a cultural festival.       "," Thrill        ","9/15/2020"," CultureEnthusiast ","1"," #Thrill #CulturalCelebration              ","40","80"," India              ","2020","9","15","14","1","1","1","1","1","1","No Depresseion"
" Dismissive gestures, a curtain drawn to shield the vulnerability, a stage where emotions take a backseat to the performance of indifference. "," Dismissive ","8/18/2018"," CurtainShield ","1"," #Dismissive #IndifferencePerformance ","12","24"," Australia ","2018","8","18","14","3","3","3","2","3","3","Moderate Depression"
"In the dance of positivity, every step is a rhythm, uplifting the soul in harmony. "," Positivity ","9/18/2016"," DanceHarmony ","1"," #Positivity #SoulUpliftment ","18","35"," France ","2016","9","18","19","1","1","1","1","1","1","No Depresseion"
" Embraced by the hopeful dawn, a gardener sowing seeds of optimism, tending to the blooms of a brighter tomorrow. "," Hopeful ","7/17/2022"," DawnGardener ","1"," #Hopeful #SeedsOfOptimism ","14","28"," UK ","2022","7","17","6","1","2","2","1","1","1","No Depresseion"
"Encountered some mean-spirited comments online. Dealing with online hate is never easy. "," Hate ","9/12/2023"," DealingWithHateHighSchool ","1"," #OnlineHate #HighSchoolReality ","18","36"," Canada","2023","9","12","12","4","4","4","3","4","4","Severel Depression Depression"
"Lost in the enchantment of Disneyland, each ride a journey into the realm of childhood fantasies. "," Enchantment ","9/28/2022"," DisneylandExplorer ","1"," #Enchantment #ChildhoodFantasies ","30","60"," USA ","2022","9","28","15","1","1","1","1","1","1","No Depresseion"
"Watching a heartwarming family drama, tears flow freely as the characters overcome challenges, leaving the viewer with a warm glow. "," Touched ","1/15/2021"," DramaEnthusiastHeartwarmingMoments ","1"," #Touched #FamilyDramaMoments ","28","55"," India ","2021","1","15","18","1","1","1","1","1","1","No Depresseion"
"Chasing dreams under the vibrant sky, a journey fueled by hope and enthusiasm. "," Enthusiasm ","10/28/2019"," DreamChaser ","1"," #Enthusiasm #HopefulJourney ","30","60"," Australia ","2019","10","28","14","1","1","1","1","1","1","No Depresseion"
" Shattered dreams lie on the floor like fragments of glass, a mosaic of disappointment crafted by the hands of frustration. "," Frustrated ","1/7/2022"," DreamMosaic ","1"," #Frustrated #MosaicOfDisappointment ","15","30"," Canada ","2022","1","7","11","3","3","3","2","3","3","Moderate Depression"
" Gazing towards the horizon with hopeful eyes, painting a canvas of dreams illuminated by the sun of optimism. "," Hopeful ","4/18/2022"," DreamPainter ","1"," #Hopeful #CanvasOfDreams ","12","24"," India ","2022","4","18","8","2","2","2","2","2","2","Minimal Depression"
"The echoes of solitude, a silent conversation between a soul and its shadows. "," Solitude ","6/15/2016"," EchoedConversation ","1"," #Solitude #ShadowConversation ","30","60"," Spain ","2016","6","15","22","4","4","4","4","4","4","Severel Depression Depression"
"Suffocating in the silence of solitude, where echoes of laughter once thrived. "," Isolation ","5/20/2022"," EchoedLaughter ","1"," #Isolation #SilentSolitude ","30","60"," South Africa ","2022","5","20","20","5","5","5","5","5","5","Critical Depression"
" Loneliness echoes in empty spaces, yearning for connection."," Loneliness ","9/12/2019"," EchoingSoul     ","1"," #Loneliness #YearningForConnection         ","15","30"," Australia     ","2019","9","12","18","1","1","1","1","1","1","No Depresseion"
"In the carnival of emotions, the rollercoaster of thrill sends the heart on a wild ride. "," Thrill ","3/28/2019"," EmotionCarnival ","1"," #Thrill #WildHeartRide ","35","70"," South Africa ","2019","3","28","15","1","1","2","1","2","1","Minimal Depression"
" Curiosity leading me down the rabbit hole of knowledge, a perpetual student in life's classroom. "," Curiosity       ","10/8/2022"," EternalLearner    ","1"," #Curiosity #KnowledgeQuest                ","20","40"," USA          ","2022","10","8","8","1","2","1","1","1","1","Minimal depression"
"Attending a school club meeting to explore new interests. Dabbling in extracurricular activities. "," Neutral ","10/7/2023"," ExtracurricularExplorationHighSchool ","1"," #SchoolClubs #HighSchoolInterests ","22","45"," UK","2023","10","7","20","2","2","1","1","2","1","No Depression"
"Whimsical delight in a world of whimsical fairy tales.             "," Whimsy        ","3/8/2016"," FairyTaleAdventurer ","1"," #Whimsy #FairyTaleMagic                 ","20","40"," USA             ","2016","3","8","14","1","1","1","1","1","1","Minimal Depression"
"Whimsical delight in a world of fairy tales and magical creatures.  "," Whimsy        ","3/8/2016"," FairyTaleExplorer ","1"," #Whimsy #MagicalWorld                    ","20","40"," USA             ","2016","3","8","14","2","1","1","1","1","1","Minimal Depression"
"Drenched in nostalgia while flipping through an old family photo album. "," Nostalgia ","12/5/2016"," FamilyHistorian ","1"," #Nostalgia #FamilyPhotoAlbum           ","25","50"," India          ","2016","12","5","21","1","1","1","1","1","1","Minimal Depression"
"Hosted a family dinner, where laughter echoed louder than the clinking of utensils. Family, the heart of happiness. #FamilyDinner #SeniorHost "," Contentment ","7/4/2023"," FamilyHostSenior ","1"," #HeartwarmingMoments #SeniorFamily ","35","70"," USA","2023","7","4","17","1","1","1","1","1","1","No Depresseion"
" Sending affectionate vibes to friends and family.        "," Affection    ","2/24/2023"," FamilyLover     ","1"," #Affection #FamilyLove                      ","15","30","USA","2023","2","24","16","1","1","1","1","1","1","No Depression"
"Got my hands on the latest fantasy novel. Diving into realms of magic and adventure! "," Excitement ","8/13/2023"," FantasyBookNerdHighSchool ","1"," #FantasyBookNerd #HighSchoolReader ","35","70"," UK","2023","8","13","20","1","1","1","1","1","1","No Depresseion"
"Bittersweet emotions arise while bidding farewell to a dear friend. "," Bittersweet ","3/15/2020"," FarewellSender ","1"," #Bittersweet #Farewell                     ","20","40"," Japan             ","2020","3","15","18","2","2","2","1","2","2","Minimal Depression"
"In the realm of fashion, the designer unveils a collection that tells a story, blending innovation and tradition on the runway of creativity. "," Runway Creativity ","11/10/2015"," FashionEnthusiastDesignerShowcase ","1"," #RunwayCreativity #FashionInnovation ","28","55"," Italy ","2015","11","10","21","1","1","1","1","1","1","No Depresseion"
" The fear of the unknown is keeping me up at night.    "," Fear         ","2/20/2023"," FearfulDreamer  ","1"," #Fear #Unknown                               ","15","30"," USA          ","2023","2","20","21","3","3","4","2","3","3","Moderate Depression"
" Arousal of excitement for an upcoming festival.       "," Arousal       ","9/25/2017"," FestivalFan     ","1"," #Arousal #FestivalExcitement               ","20","40"," UK ","2017","9","25","11","1","1","1","1","1","1","No Depression"
"As the movie credits roll, the viewer experiences a mix of awe and contemplation, pondering the deeper meanings woven into the storyline. "," Contemplation ","11/5/2019"," FilmBuffContemplativeViewer ","1"," #Contemplation #DeepMeanings ","28","55"," Germany ","2019","11","5","21","2","2","2","2","2","2","Minimal Depression"
"As the credits roll, a profound sense of nostalgia washes over, reminiscent of cherished moments in classic films. "," Nostalgia ","6/25/2019"," FilmLoverNostalgiaSeeker ","1"," #Nostalgia #ClassicFilmMoments ","35","70"," UK ","2019","6","25","22","2","2","2","2","2","2","Minimal Depression"
"In the celebration of success, fireworks of accomplishment light up the night sky of triumph. "," Success ","11/15/2017"," FireworksTriumph ","1"," #Success #NightSkyTriumph ","22","45"," Japan ","2017","11","15","22","1","1","1","1","1","1","No Depresseion"
" Pride in completing a challenging fitness challenge.    "," Pride        ","2/28/2023"," FitAchiever     ","1"," #Pride #FitnessChallengeCompleted          ","30","60"," UK            ","2023","2","28","16","1","1","1","1","1","1","No depression"
" New year, new fitness goals! ðŸ’ª                    "," Positive  ","1/28/2023"," FitJourney   ","1"," #NewYear #FitnessGoals                  ","28","55"," USA        ","2023","1","18","18","1","1","1","1","1","1","No Depresseion"
" Elation after achieving a fitness milestone.         "," Elation       ","6/15/2019"," FitnessAchiever2","1"," #Elation #FitnessMilestone                   ","25","50"," UK           ","2019","6","15","10","2","1","1","1","1","1","No Depression"
" Just finished an amazing workout! ðŸ’ª               "," Positive  ","1/17/2023"," FitnessFan   ","1"," #Fitness #Workout                        ","20","40"," USA        ","2023","1","15","15","1","1","1","1","1","1","No Depresseion"
"In the heart of a bustling market, the street food connoisseur indulges in a culinary adventure, savoring diverse flavors and aromas. "," Culinary Adventure ","8/28/2019"," FoodieMarketStreetFoodExploration ","1"," #CulinaryAdventure #StreetFoodDelights ","35","70"," Thailand ","2019","8","28","19","1","1","1","1","1","1","No Depresseion"
"Celebrating a historic victory in the World Cup, the nation erupts in joy, united by the triumph of their football team. "," Joy ","7/15/2018"," FootballFanWorldCupCelebration ","1"," #Joy #WorldCupTriumph ","40","80"," Brazil ","2018","7","15","21","1","1","1","","1","1","No Depresseion"
" Devastated by the revelation of betrayal, the trust shattered like fragile glass, leaving shards of pain in its wake. "," Devastated ","5/20/2022"," FragileTrust ","1"," #Devastated #ShatteredTrust ","25","50"," Canada ","2022","5","20","14","4","4","4","3","4","4","Severel Depression Depression"
"Feeling a sense of emptiness after a close friend moves away. Farewells are always sad. "," Sad ","9/24/2023"," FriendMovingAwayHighSchool ","1"," #SayingGoodbye #HighSchoolEmotions ","21","42"," Canada","2023","9","24","17","3","3","3","2","3","3","Moderate Depression"
